{
  "schema_version": "standalone_path_persistence.v1",
  "bound_plan_id": "path-plan-posix-installer-user",
  "bound_plan_sha256": "8dc46f4b15d02e34610798ccf6011eef516a3184ee17333b3291940e78cd7858",
  "result": "installer_persisted",
  "mutation_performed": true,
  "entry_state": "added",
  "observed_scope": "user",
  "current_process_env_mutated": true,
  "new_session_required": true,
  "owned_entries_observed": 1,
  "instrument_complete": true,
  "redaction_policy": "bounded_typed_fields_only"
}
