{
  "schema_version": "standalone_path_persistence.v1",
  "bound_plan_id": "path-plan-wsl-already-visible",
  "bound_plan_sha256": "84d68076c4c22a7190ade15ae289752fbe6f53c3779b33cf87fb773958cebf60",
  "result": "already_visible_no_change",
  "mutation_performed": false,
  "entry_state": "already_present",
  "observed_scope": "user",
  "current_process_env_mutated": false,
  "new_session_required": false,
  "owned_entries_observed": 1,
  "instrument_complete": true,
  "redaction_policy": "bounded_typed_fields_only"
}
